,ID,datetime,has_media,is_reply,is_retweet,medias,nbr_favorite,nbr_reply,nbr_retweet,text,url,user_id,usernameTweet,team
225,986701337269297153,2018-04-18 16:21:45,,False,False,,1,0,1,# Rockies  #Frankfurt  #Therockyhorrorpictureshow  #Doctor  #Fantasy  #Horror  #Draw  #LGBTQ  #Sweet  #Pencil  #Color  #CreativeMIVotes  #Musical  #Vintage  #Timkurry  #Suns pic.twitter.com/nx3ChL1FTE,/ShiruviaArt/status/986701337269297153,950739702000373760,ShiruviaArt,rockies
226,991475628548481025,2018-05-01 20:33:05,,True,False,,16,1,1,"you don’t have to agree with Ms.Byres lifestyle or even understand it, all you gotta do is respect it!  LGBTQ + individuals are ostracized enough, we don’t need more negativity thrown at us! The other students and I are simply trying to spread the message of acceptance...",/IvanD_Castillo/status/991475628548481025,611054804,IvanD_Castillo,rockies
227,997439034480889857,2018-05-18 07:29:31,,False,False,,0,0,0,"I watched the replay Colorado  Rockies  game early this morning against the San Francisco Giants in my RAINBOW pj. I said we r taking the rainbow back from the  LGBTQ , if we win!!! We won, yahoo!!!",/eveofdestructio/status/997439034480889857,36753394,eveofdestructio,rockies
228,997865798734569473,2018-05-19 11:45:20,,False,False,,7,0,3,".@Pirates  anyway to get one of these  LGBTQ + hats in hostile  Rockies  territory? I am Pittsburgh born-and-raised. Our small fry got his first Bucs hat for his 1st birthday. Here he is hiking, without pants (who needs 'em!?) in his favorite cap!

 https://www. outsports.com/2018/5/15/1733 6226/major-league-baseball-lgbt-pride-hats   … pic.twitter.com/e3kF3H0Zzs",/theDeuceCuatro/status/997865798734569473,109697902,theDeuceCuatro,rockies
